Sentence,Definition?
"The science of breaking codes , which is one part of cryptology .",0
"The half - angle illustrated above is given by θ | = | cot^(-1 ) ϕ  | = | 1/4[π - tan^(-1)(4/3 ) ] | ≈ | 0.553574  | ≈ | 31.7175 ° .",0
"Stratton , Chu and Stratton , and Rhodes define the spheroidal functions as those solutions of the differential equation ( 1 - ־·^2 ) ֿˆ_(־±n)^ , , ( c , ־· ) - 2(־± + 1 ) ־·ֿˆ_(־±n)^ , ( c , ־· ) + ( b_(־±n ) - c^2 ־·^2 ) ֿˆ_(־±n)(c , ־· ) = 0 that remain finite at the singular points ־· = ֲ± 1 .",1
"A congruent number can be defined as an integer that is equal to the area of a rational right triangle .",1
"A compound also called Bakos ' compound having the symmetry of the cube which arises by joining four cubes such that each C_3 axis falls along the C_3 axis of one of the other cubes .",1
"The figure above shows a projection of the tesseract in three - space .",0
"The term is frequently applied to specific orders of Newton - Cotes formulas .",0
"The first few terms using the above indexing convention for n = 0 , 1 , 2 , ... are 0 , 1 , 1 , 2 , 4 , 7 , 13 , 24 , 44 , 81 , 149 , ...",0
"An edge coloring containing the smallest possible number of colors for a given graph is known as a minimum edge coloring .",1
"The original curve is then said to be the involute of its evolute .",0
"This is illustrated above for T_1 = 1 , T_2 = 3 , ....",0
"Given a Poisson distribution with a rate of change ־» , the distribution function D(x ) giving the waiting times until the hth Poisson event is D(x ) | = | 1 - sum_(k = 0)^(h - 1 ) e^(-־»x ) ( ־»x)^k/(k ! ) | = | 1 - ( ־“(h , x־»))/(־“(h ) ) for x element [ 0 , גˆ ) , where ־“(x ) is a complete gamma function , and ־“(a , x ) an incomplete gamma function .",1
"Note that -1 ! ! = 0 ! ! = 1 , by definition .",0
"Catalan 's constant may be defined by K = sum_(k = 0)^∞ ( -1)^k/(2k + 1)^2 ( Glaisher 1877 , who however did not explicitly identify the constant in this paper ) .",1
"The name nephroid means  kidney shaped  and was first used for the two - cusped epicycloid by Proctor in 1878 ( MacTutor Archive ) .",1
"The top portion shows S_1 to S_255 , and the bottom shows the next 510 values .",0
"The word  degree  has many meanings in mathematics .",0
"The factorial n ! is defined for a positive integer n as n ! congruent n(n - 1) ... 2·1 .",1
"Trott 2004 , p. 17 , mistakenly states that the catacaustic for parallel light falling on any concave mirror is a nephroid .",0
"Because the area element is given by dA = 2πrdr , this gives a concentration of points in the center ( left figure above ) .",0
"The quadratic residues in the finite field GF(11 ) form a difference set .",0
"An invariant defined using the angles of a three - dimensional polyhedron .",0
"Cylindrical coordinates are a generalization of two - dimensional polar coordinates to three dimensions by superposing a height ( z ) axis .",1
"There are several formal counterparts to this informal definition , many of which only differ in trivial respects .",0
"Originally a Norman form of a Germanic name , which was composed of the elements hrod  fame  and heid  kind , sort , type  .",0
"More generally , a function f(x ) is convex on an interval [ a , b ] if for any two points x_1 and x_2 in [ a , b ] and any ־» where 0 < ־»<1 , f[־»x_1 + ( 1 - ־» ) x_2]<=־»f(x_1 ) + ( 1 - ־» ) f(x_2 ) ( Rudin 1976 , p. 101 ; cf .",1
"Here , the division algorithm requires an order of a certain type on the monomials .",0
"Its rule outcomes are encoded in the binary representation 54 = 110110_2 .",0
"For a curve represented by ( f(t , c ) , g(t , c ) ) , the envelope is found by solving 0 = ( df)/(dt)(dg)/(dc ) - ( df)/(dc)(dg)/(dt ) .",0
"Si(z ) is an entire function .",0
"The ratio of r to s is equivalent to the quotient r / s .",0
"A spheroidal harmonic is a special case of an ellipsoidal harmonic that satisfies the differential equation d/(dx)[(1 - x^2)(dS)/(dx ) ] + ( ־» - c^2 x^2 - m^2/(1 - x^2 ) ) S = 0 on the interval -1<=x<=1 .",1
"The statistical median is an order statistic that gives the  middle  value x^~ of a sample .",1
"The transformation equations are x | = | u/(u^2 + v^2 + w^2 ) y | = | v/(u^2 + v^2 + w^2 ) z | = | w/(u^2 + v^2 + w^2 ) .",0
"An optical illusion , illustrated above , in which the eye perceives a white upright equilateral triangle where none is actually drawn .",0
"The standard proof of the first proceeds by noting that f is the continuous image of a compact set on the interval [ a , b ] , so it must itself be compact .",0
"C_4 is one of the two groups of group order 4 .",0
"A quantity which does not exhibit estimator bias .",0
"The symmetric group S_n of degree n is the group of all permutations on n symbols .",1
"The curvature of a surface satisfies κ = κ_1 cos^2 θ + κ_2 sin^2 θ , where κ is the normal curvature in a direction making an angle θ with the first principal direction and κ_1 and κ_2 are the principal curvatures .",0
"There are a number of functions in various branches of mathematics known as Riemann functions .",0
"A cubic symmetric graph is a symmetric cubic ( i.e. , regular of order 3 ) .",1
"The maximum likelihood estimate for a parameter μ is denoted μ^^.",0
"Such functions satisfy the differential equation ( d^2 x)/(dt^2 ) + ω^2 x = 0 , which has solution x = Acos(ωt + ϕ_1 ) + Bsin(ωt + ϕ_2 ) .",0
"In general , it is also true that ( left bracketing bar V_i W_i right bracketing bar ) / ( left bracketing bar W_(i + 1 ) V_(i + 2 ) right bracketing bar ) = ( left bracketing bar V_i V_(i + 1 ) V_(i + 4 ) right bracketing bar ) / ( left bracketing bar V_i V_(i + 1 ) V_(i + 2 ) V_(i + 4 ) right bracketing bar ) ( left bracketing bar V_i V_(i + 1 ) V_(i + 2) V_(i + 3 ) right bracketing bar ) / ( left bracketing bar V_(i + 2 ) V_(i + 3 ) V_(i + 1 ) right bracketing bar ) .",0
"It is concave , and consists of 12 intersecting pentagonal faces ( 12{5 } ) .",0
"If L^~ is a linear operator on a function space , then f is an eigenfunction for L^~ and ־» is the associated eigenvalue whenever L^~ f = ־»f .",1
"It is a block design with ν = 7 , k = 3 , λ = 1 , r = 3 , and b = 7 , the Steiner triple system S(7 ) , and the unique 7_3 configuration .",0
"The radical lines of three circles are concurrent in a point known as the radical center ( also called the power center ) .",1
"The vectors in a slope field are usually drawn without arrowheads , indicating that they can be followed in either direction .",0
"So a map f : Aג†¦B from A to B is a function f such that for every a element A , there is a unique object f(a ) element B.",1
"The differential equation describing exponential growth is ( dN)/(dt ) = rN.",1
"The resulting motion can produce beautiful , complicated curves which eventually terminate in a point as the motion of the pendula is damped by friction .",0
"Then Simpson 's 3/8 rule approximating the integral of f(x ) is given by the Newton - Cotes - like formula integral_(x_1)^(x_4 ) f(x ) dx = 3/8 h(f_1 + 3f_2 + 3f_3 + f_4 ) - 3/80 h^5 f^(4)(ξ ) .",0
"To multiply two numbers a and b , write a_0 congruent a and b_0 congruent b in two columns .",0
"The number of partitions of n with k or fewer addends , or equivalently , into partitions with no element greater than k.",0
"Depending on how they are generated , a random variate can be uniformly or nonuniformly distributed .",0
"Similarly , a ring is commutative if the multiplication operation is commutative , and a Lie algebra is commutative if the commutator [ A , B ] is 0 for every A and B in the Lie algebra .",1
"The incenter I and excenters J_i of a triangle are an orthocentric system .",0
"Rooted trees are equivalent to oriented trees .",0
"It satisfies the identity exp(x + y ) = exp(x ) exp(y ) .",0
"This rule is illustrated above together with the evolution of a single black cell it produces after 15 steps .",0
".",0
"The first few are 1 , 5 , 12 , 22 , 35 , 51 , 70 , ... ( OEIS A000326 ) .",0
"Any particular element X moves around in a fixed path which is called its orbit .",1
"Let the planes be specified in Hessian normal form , then the line of intersection must be perpendicular to both ( n_1)^^ and ( n_2)^^ , which means it is parallel to a = ( n_1)^^x(n_2)^^ .",0
"Although it is known that an infinite number of zeros lie on the critical line and that these comprise at least 40 % of all zeros , the Riemann hypothesis is still unproven .",0
"Now extend the  whiskers  to the farthest points that are not outliers ( i.e. , that are within 3/2 times the interquartile range of Q_1 and Q_3 ) .",0
"Surprisingly , the circumcenters O_(AB ) , O_(BA ) , etc . of the six circumcircles of these smaller triangles ( shown in blue above ) are concyclic .",0
"For symmetrically placed nails , balls will bounce left or right with equal probability , so p = q = 1/2 .",0
"Reverse Polish notation ( RPN ) is a method for representing expressions in which the operator symbol is placed after the arguments being operated on .",1
"A dissection fallacy is an apparent paradox arising when two plane figures with different areas seem to be composed by the same finite set of parts .",1
"The polygonal numbers illustrated above are called triangular , square , pentagonal , and hexagonal numbers , respectively .",0
"Since two lines in the plane must intersect or be parallel , skew lines can exist only in three or more dimensions .",0
"Beautiful photographs of cone net models ( lower diagrams above ) are presented in Steinhaus .",0
"It is sometimes denoted M_n.",0
"The reverse of excision is insertion .",1
"If quadrature is possible for a plane figure , it is said to be quadrable .",1
"Lagrange multipliers , also called Lagrangian multipliers , can be used to find the extrema of a multivariate function f(x_1 , x_2 , ... , x_n ) subject to the constraint g(x_1 , x_2 , ... , x_n ) = 0 , where f and g are functions with continuous first partial derivatives on the open set containing the curve g(x_1 , x_2 , ... , x_n ) = 0 , and del g!=0 at any point on the curve ( where del is the gradient ) .",0
"The absolute value is therefore always greater than or equal to 0 .",0
"Now , the angular lengths of the sides of the triangle ( in radians ) are then a ' congruent ∠BOC , b ' congruent ∠COA , and c ' congruent ∠AOB , and the actual arc lengths of the side are a = Ra ' , b = Rb ' , and c = Rc ' .",0
"In spherical geometry , straight lines are great circles , so any two lines meet in two points .",0
"Taking the ratio x /y of two numbers x and y , also written x÷y .",0
"The first curve is a rotated cardioid ( whose name means  heart - shaped  ) given by the polar equation r(θ ) = 1 - sinθ .",0
"Other common levels for square waves include ( -1 , 1 ) and ( 0 , 1 ) ( digital signals ) .",0
"A level set in two dimensions .",0
"A topological sort is a permutation p of the vertices of a graph such that an edge { i , j } implies that i appears before j in p.",1
"The determination of the eigenvalues and eigenvectors of a system is extremely important in physics and engineering , where it is equivalent to matrix diagonalization and arises in such common applications as stability analysis , the physics of rotating bodies , and small oscillations of vibrating systems , to name only a few .",0
"For triangles in the plane , AD·BE·CF = BD·CE·AF .",0
"A plane curve may be closed or open .",0
"When all the points P on one line are related by an isometry to all points P ' on another , the midpoints of the segments PP ' are either distinct and collinear or coincident .",0
"A hypersurface is therefore the set of solutions to a single equation f(x_1 , ... , x_n ) = 0 and so it has codimension one .",0
"It has equivalent triangle center functions α_10 | = | bc(b + c ) α_10 | = | ( b + c)/a , and is Kimberling center X_10 .",0
"The usual torus embedded in three - dimensional space is shaped like a donut , but the concept of the torus is extremely useful in higher dimensional space as well .",0
"The first n columns correspond to the possible values of n inputs , and the last column to the operation being performed .",0
"A homeomorphism which also preserves distances is called an isometry .",1
"A normal distribution in a variate X with mean ־¼ and variance ֿƒ^2 is a statistic distribution with probability density function P(x ) = 1/(ֿƒsqrt(2ֿ€ ) ) e^(-(x - ־¼)^2/(2ֿƒ^2 ) ) on the domain x element ( -גˆ , גˆ ) .",1
"As a result of a truly amazing property of holomorphic functions , such integrals can be computed easily simply by summing the values of the complex residues inside the contour .",0
"It has Schläfli symbol s{3 4 } and Wythoff symbol |234 .",0
"The plots above correspond to the function f(r , θ ) = sin(6cosr - nθ ) for n = 0 , 1 , ... , 5 .",0
"The earliest definition of stochastic resonance was the maximum of the output signal strength as a function of noise .",1
"A regular pyramid is a right pyramid whose base is a regular polygon .",1
"A right angle is an angle equal to half the angle from one end of a line segment to the other .",1
"Gear teeth were also made out of cycloids , as first proposed by Desargues in the 1630s .",0
"There are four completely different definitions of the so - called Apollonius circles : 1 .",1
"The imaginary unit is denoted and commonly referred to as  i.",0
"It has Schläfli symbol t{3 , 3 } and Wythoff symbol 23|3 .",0
"This rule is illustrated above together with the evolution of a single black cell it produces after 15 steps ( OEIS A075439 ; Wolfram 2002 , p. 55 ) .",0
"For example , the circular ( left ) embedding of the cubical graph illustrates this graph 's inherent symmetries .",0
"Find a way to stack a square of cannonballs laid out on the ground into a square pyramid ( i.e. , find a square number which is also square pyramidal ) .",0
"Defining w congruent f(z ) and σ congruent f(γ ) gives N - P = 1/(2πi ) integral_σ ( dw)/w .",0
"In addition to the grid on which a cellular automaton lives and the colors its cells may assume , the neighborhood over which cells affect one another must also be specified .",0
"The general linear group GL_n(q ) is the set of nֳ—n matrices with entries in the field F_q which have nonzero determinant .",1
"Guy 's conjecture , which has not yet been proven or disproven , states that the graph crossing number for a complete graph of order n is 1/4גn/2ג‹ג(n - 1)/2ג‹ג(n - 2)/2ג‹ג(n - 3)/2ג‹ , where גxג‹ is the floor function , which can be rewritten { 1/64 n(n - 2)^2(n - 4 ) | for n even 1/64(n - 1)^2 ( n - 3)^2 | for n odd .",1
"Similarly , the plots above show Saunders graphics for the same functions in base b = 10 for digits d = 1 and 2 .",0
"Examples of binary operation on A from A×A to A include addition ( + ) , subtraction ( - ) , multiplication ( × ) and division ( ÷ ) .",0
"The azimuthal angle is an angle measured from the x - axis in the xy - plane in spherical coordinates , denoted ־¸ in this work .",1
"The chromatic polynomial of a graph of order n has degree n , with leading coefficient 1 and constant term 0 .",0
"However , some authors define the incidence matrix to be the transpose of this , with a column for each vertex and a row for each edge .",0
"This makes a χ^2 distribution a gamma distribution with θ congruent 2 and α congruent r/2 , where r is the number of degrees of freedom .",0
"The midpoint of a line segment is easy to locate by first constructing a lens using circular arcs , then connecting the cusps of the lens .",0
"Abramowitz and Stegun give a table of the parameters of most common continuous distributions .",0
"An inscribed angle is an angle גˆ ABC formed by points A , B , and C on the circle 's circumference .",1
"The power may be an integer , real number , or complex number .",0
"If all faces are congruent , the tetrahedron is known as an isosceles tetrahedron .",1
"It specifies the next color in a cell , depending on its color and its immediate neighbors .",0
"As a result , the special complexity class graph isomorphism complete is sometimes used to refer to the problem of graph isomorphism testing .",0
"Another elegant solution was provided by André using the so - called André 's reflection method .",0
"The Dirichlet function can be written analytically as D(x ) = lim_(m->∞ ) lim_(n->∞ ) cos^(2n)(m!πx ) .",0
"Eigenvectors are a special set of vectors associated with a linear system of equations ( i.e. , a matrix equation ) that are sometimes also known as characteristic vectors , proper vectors , or latent vectors .",1
"It is Archimedean solid A_7 , uniform polyhedron U_12 , and Wenninger model W_17 .",0
"Define the packing density ־· of a packing of spheres to be the fraction of a volume filled by the spheres .",1
"A sequence of functions { f_n } , n = 1 , 2 , 3 , ... is said to be uniformly convergent to f for a set E of values of x if , for each ֿµ>0 , an integer N can be found such that left bracketing bar f_n(x ) - f(x ) right bracketing bar < ֿµ for n>=N and all x element E.",1
"An odd number is an integer of the form n = 2k + 1 , where k is an integer .",1
"The term  Gosper island  was used by Mandelbrot because this curve bounds the space filled by the Peano - Gosper curve .",0
"May 's theorem states a stronger result .",0
"A function which is both an injection and a surjection is said to be a bijection .",1
"If neither implicates the other , both will receive the usual sentence .",0
"Moreover , because the canonical partial numerators { A_n}_(n = 1)^∞ , respectively partial denominators { B_n}_(n = 1)^∞ , of an arbitrary continued fraction ξ = continued fraction k _ ( n=1)^∞ a_n / b_n are also elements of L , it follows that A_n and B_n are C - linear combinations of ϕ^(n + 1 ) and ψ^(n + 1 ) for any arbitrary continued fraction ξ = continued fraction k _ ( n=1)^∞ a_n / b_n , n = 1 , 2 , 3 , ....",0
"Characteristic functions are sometimes denoted using the so - called Iverson bracket , and can be useful descriptive devices since it is easier to say , for example ,  the characteristic function of the primes  rather than repeating a given definition .",0
"Lévy showed that β element ( 0 , 2 ) for P(x ) to be nonnegative .",0
"Any two rectilinear figures with equal area can be dissected into a finite number of pieces to form each other .",0
"The Penrose triangle , also called the tribar ( Cerf ) , tri - bar , impossible tribar , or impossible triangle , is an impossible figure published by Penrose and Penrose .",1
"M(n ) is also given by the determinant of the n×n Redheffer matrix .",0
"In a mathematician 's terminology , a graph is a collection of points and lines connecting some ( possibly empty ) subset of them .",1
"The Poggendorff illusion was discovered in 1860 by physicist and scholar J. C. Poggendorff , editor of Annalen der Physik und Chemie , after receiving a letter from astronomer F. Z?llner .",0
"( Obviously , only a single angle in a triangle can be obtuse or it would n't be a triangle . ) A triangle must be either obtuse , acute , or right . From the law of cosines , for a triangle with side lengths a , b , and c , cosC = ( a^2 + b^2 - c^2)/(2ab ) , with C the angle opposite side C.",0
"For example , 2/5 is a common fraction , while ( 1/3)/(2/5 ) is not .",0
"An algebraic integer of the form a + bsqrt(D ) where D is squarefree forms a quadratic field and is denoted Q(sqrt(D ) ) .",0
"A convex polyhedron can be defined algebraically as the set of solutions to a system of linear inequalities mx<=b , A convolution is an integral that expresses the amount of overlap of one function g as it is shifted over another function f. It therefore  blends  one function with another .",1
"In the case of three - dimensional space , the rotation group is known as the special orthogonal group .",1
"Doob defines a stochastic process as a family of random variables { x(t , ג€¢ ) , t element J } from some probability space ( S , S , P ) into a state space ( S ' , S ' ) .",1
"An algebraic surface of order 3 .",0
"Note that while European writers generally prefer the British spelling  q - analogue  , American authors prefer the shorter  q - analog  ( Andrews et al .",0
"In this episode , character Dr. Reid also notices that locations of the killings lie on the graph of a golden spiral , and going to the center of the spiral allows Reid to determine the location of the killer 's base of operations .",0
"A periodic minimal surface constructed by Schwarz using the following two principles : 1 .",0
"If the ratio r = 1 , the conic is a parabola , if r<1 , it is an ellipse , and if r>1 , it is a hyperbola .",0
"The quantities ?_k such that ?_k^n = 1 are called the nth roots of unity .",1
"For example , a vector space can have a vector basis which spans the vector space by finite linear combinations .",0
"At each step , the machine may modify the color of the active cell and change the state of the head .",0
"This can be done by expanding ( -1 ) using the trigonometric addition formulas to obtain f(θ ) = ccosθcosδ - csinθsinδ .",0
"The relationship between a line integral around a simple closed curve and a double integral over the plane region bounded by the curve , which may be stated as ∮_dDf(x , y ) dx + g(x , y ) dy = integral integral_D(dg(x , y)/(dx ) - df(x , y)/(dy ) ) dx dy .",0
"An equation of the form P(x ) = 0 , where P(x ) is a polynomial .",0
"It can also be used to refer to the bottom edge or surface of a geometric figure .",0
"In other words , the multiplicative order of p ( mod 10 ) is p - 1 .",0
"If all faces are congruent to an equilateral triangle , then the tetrahedron is known as a regular tetrahedron ( although the term  tetrahedron  without further qualification is often used to mean  regular tetrahedron  ) .",1
"The problem of determining ( or counting ) the set of all solutions to a given problem .",0
"The set of all points whose distances from two fixed points are in a constant ratio 1 : μ .",0
"The negative derivative S(v ) = - D_v N of the unit normal N vector field of a surface is called the shape operator ( or Weingarten map or second fundamental tensor ) .",1
"It is a cubic symmetric graph , nonplanar , and Hamiltonian .",0
"A similar phenomenon occurs for daisies , pineapples , pinecones , cauliflowers , and so on .",0
"The properties of these formulas are intimately connected with cotangent identities .",0
"Ueberhuber uses the word  quadrature  to mean numerical computation of a univariate integral , and  cubature  to mean numerical computation of a multiple integral .",1
"Rule 182 is amphichiral and has mirror complement rule 146 .",0
"The Barnes G - function is an analytic continuation of the G - function defined in the construction of the Glaisher - Kinkelin constant G(n ) congruent [ Γ(n)]^(n - 1)/(H(n - 1 ) ) for n>0 , where H(n ) is the hyperfactorial , which has the special values G(n ) = { 0 | if n = - 1 , -2 , ...  ( n - 2 ) ! | if n = 0 , 1 , 2 , ...",1
"A McNugget number is a positive integer that can be obtained by adding together orders of McDonald 's ֲ® Chicken McNuggets ג„¢ ( prior to consuming any ) , which originally came in boxes of 6 , 9 , and 20 ( Vardi 1991 , pp .",1
"The unit vector obtained by normalizing the normal vector ( i.e. , dividing a nonzero normal vector by its vector norm ) is the unit normal vector , often known simply as the  unit normal .",1
"Let O and I be the circumcenter and incenter of a triangle with circumradius R and inradius r.",0
"q - analogs also have a combinatorial interpretation based on the fact that one can count the elements of some set S to get the number # S.",0
"The Kneser graphs are a class of graph introduced by Lovֳ¡sz to prove Kneser 's conjecture .",1
"The Szilassi polyhedron has 14 polyhedron vertices , seven faces , and 21 polyhedron edges , and is the dual polyhedron of the Császár polyhedron .",0
"The illustration above shows two regions of space for the map with α = 0.2 and β = 1.01 colored according to the number of iterations required to escape .",0
"In hexagonal close packing , layers of spheres are packed so that spheres in alternating layers overlie one another .",0
"The ordering of a deck of 52 cards after an out - shuffle is given by 1 , 27 , 2 , 28 , 3 , 29 , ... ( OEIS A059953 ) .",0
"It can be constructed as the graph expansion of 5P_2 with steps 1 and 2 , where P_2 is a path graph .",0
"The most common form of linear regression is least squares fitting .",0
"The implied summation over repeated indices without the presence of an explicit sum sign is called Einstein summation , and is commonly used in both matrix and tensor analysis .",1
"In two dimensions , the best - known cellular automaton is Conway 's game of life , discovered by J. H. Conway in 1970 and popularized in Martin Gardner 's Scientific American columns .",1
"Leibniz found the curve using the fact that the axis is an asymptote to the tractrix ( MacTutor Archive ) .",0
"Its rule outcomes are encoded in the binary representation 50 = 1100100_2 .",0
"Note that the operator del ^2 is commonly written as Δ by mathematicians .",0
"A prime p is full reptend iff 10 is a primitive root modulo p , which means that 10^k congruent 1 ( mod p ) for k = p - 1 and no k less than this .",0
"Care should be taken to not confuse the terms  vector norm  ( length of vector ) ,  normal vector  ( perpendicular vector ) and  normalized vector  ( unit - length vector ) .",0
"The rules and 300 steps of the ternary ( k = 3 ) code 912 automaton are illustrated above .",0
"Then there exist exactly two nonintersecting circles that are tangent to all three circles .",0
"Events are sometimes assumed to form a Borel field .",0
"The 2-cusped epicycloid is called a nephroid .",1
