Sentence,Definition?
"Therefore , 2^n - 1 can be written as 2^(rs ) - 1 , which is a binomial number that always has a factor ( 2^r - 1 ) .",0
"The harmonic mean H(x_1 , ... , x_n ) of n numbers x_i ( where i = 1 , ... , n ) is the number H defined by 1 /H congruent 1 / n sum_(i = 1)^n 1 /x_i .",1
"Bootstrap methods are generally superior to ANOVA for small data sets or where sample distributions are non - normal .",0
"A directed graph having no symmetric pair of directed edges ( i.e. , no bidirected edges ) is called an oriented graph .",1
"The probability of two or more changes in a sufficiently small interval h is essentially 0 .",0
"A random variable is a measurable function from a probability space ( S , S , P ) into a measurable space ( S ' , S ' ) known as the state space .",1
"While the usual form of adding two n - digit integers ( which consists of summing over the columns right to left and  carrying  a 1 to the next column if the sum exceeds 9 ) requires n operations ( plus carries ) , two n - digit integers can be added in about 2lgn steps by n processors using carry - lookahead addition .",0
"According to Euler 's rotation theorem , any rotation may be described using three angles .",0
"It is also a special case of a Cotes ' spiral , i.e. , the path followed by a particle in a central orbit with power law f(r ) = - μr^(-3 ) , when μ = h^2 is a constant and h is the specific angular momentum .",0
"The positive integers are the numbers 1 , 2 , 3 , ...( OEIS A000027 ) , sometimes called the counting numbers or natural numbers , denoted Z^+ .",1
"Its integral is given by integral_0^∞ ( k^s dk)/(e^(k - μ ) + 1 ) | = | e^μ Γ(s + 1 ) Φ(-e^μ , s + 1 , 1 ) | = | -Γ(s + 1 ) Li_(1 + s)(-e^μ ) , where Φ(z , s , a ) is the Lerch transcendent and Li_n(z ) is a polylogarithm .",0
"A normal number is an irrational number for which any finite pattern of numbers occurs with the expected limiting frequency in the expansion in a given base ( or all bases ) .",1
"This geometry satisfies all of Euclid 's postulates except the parallel postulate , which is modified to read : For any infinite straight line L and any point P not on it , there are many other infinitely extending straight lines that pass through P and which do not intersect L.",0
"Because the Alexander invariant of a tame knot in S^3 has a square presentation matrix , its Alexander ideal is principal and it has an Alexander polynomial denoted Δ(t ) .",1
"For example , we can multiply 384×56 .",0
"Special cases of this game give the Buffon - Laplace needle problem ( for a square grid ) and Buffon 's needle problem ( for infinite equally spaced parallel lines ) .",0
"The radical line , also called the radical axis , is the locus of points of equal circle power with respect to two nonconcentric circles .",1
"The number of multisets of length k on n symbols is called n multichoose k , denoted ( ( n k ) ) .",1
"For example , in the permutation group { 4 , 2 , 1 , 3 } , ( 143 ) is a 3-cycle and ( 2 ) is a 1-cycle .",0
"Sometimes , additional cards called  jokers  are also used .",0
"Regrettably , there seems to be no general agreement about whether to include 0 in the set of natural numbers .",0
"Given three noncollinear points , construct three tangent circles such that one is centered at each point and the circles are pairwise tangent to one another .",0
"Two lines with equations x | = | x_1 + ( x_2 - x_1 ) s x | = | x_3 + ( x_4 - x_3 ) t are skew if ( x_1 - x_3)ֲ·[(x_2 - x_1)x(x_4 - x_3)]!=0 .",1
"Signal processing , medical imaging , and quantum mechanics are three of the fields that use harmonic analysis extensively .",0
"Stochastic optimization refers to the minimization ( or maximization ) of a function in the presence of randomness in the optimization process .",1
"The function f(x , y ) = ( 1 - x)^2 + 100(y - x^2)^2 that is often used as a test problem for optimization algorithms ( where a variation with 100 replaced by 105 is sometimes used ; Germundsson 2000 ) .",0
"A series may also oscillate , causing it not to converge .",0
"Minimal surfaces are defined as surfaces with zero mean curvature .",1
"Trajectories within a strange attractor appear to skip around randomly .",0
"The number of ways of folding a strip of stamps has several possible variants .",0
"The symmetric group is a transitive group .",0
"The minimum vertex degree in a graph G is denoted ־´(G ) , and the maximum vertex degree is denoted ־”(G ) .",1
"In complex analysis , an analytic function f is said to have a pole of order n at a point z = z_0 if , in the Laurent series , a_m = 0 for m < - n and a_(-n ) ! = 0 .",1
"Backtracking can greatly reduce the amount of work in an exhaustive search .",0
"Laczkovich proved that the circle can be squared in a finite number of dissections ( ~10 ^ 50 ) .",0
"If the stamps are labeled and orientation is taken into account , the number of foldings is denoted N(n ) .",0
"A dilemma arises in deciding the best course of action in the absence of knowledge of the other prisoner 's decision .",0
"The Laguerre polynomials are solutions L_n(x ) to the Laguerre differential equation with ־½ = 0 .",1
"A sum is the result of an addition .",1
"Hoggatt and Denman showed that any obtuse triangle can be divided into eight acute isosceles triangles .",0
"Let P be the principal ( initial investment ) , r be the annual compounded rate , i^(n ) the  nominal rate ,  n be the number of times interest is compounded per year ( i.e. , the year is divided into n conversion periods ) , and t be the number of years ( the  term  ) .",0
"The Weierstrass elliptic function ℘(z;g_2 , g_3 ) describes how to get from this torus to the algebraic form of an elliptic curve .",1
"You 'll just have to put up with it .  d_n congruent p_(n + 1 ) - p_n .",0
"The reciprocal of zero is undefined .",0
"The inradius of a regular polygon with n sides and side length a is given by r = 1/2 acot(π / n ) .",0
"The most common value obtained in a set of observations .",0
"A secant line , also simply called a secant , is a line passing through two points of a curve .",1
"The smallest numbers of squares needed to create relatively prime dissections of an n×n quilt for n = 1 , 2 , ... are 1 , 4 , 6 , 7 , 8 , 9 , 9 , 10 , 10 , 11 , 11 , 11 , 11 , 12 , ... ( OEIS A005670 ) , the first few of which are illustrated above .",0
"Hofstadter has constructed such a solid for the letters G , E , and B which is illustrated on the cover of Gödel , Escher , Bach .",0
"When a group G acts on a set X ( this process is called a group action ) , it permutes the elements of X.",0
"For an angle to be obtuse , cosC<0 .",0
"Finding roots of a polynomial is therefore equivalent to polynomial factorization into factors of degree 1 .",0
"The binomial theorem describes the algebraic expansion of powers of a binomial , namely ( x + a)^ν = sum_(k=0)^∞(ν k)x^ka^(ν - k ) .",1
"The total number of ( not necessarily connected ) unlabeled n - node graphs is given by the Euler transform of the preceding sequence , 1 , 2 , 4 , 11 , 34 , 156 , 1044 , 12346 , ...",0
"An image of an object obtained by reflecting it in a mirror so that the signs of one of its coordinates are reversed .",0
"An additional property of the externally erected triangles also attributed to Napoleon is that their circumcircles concur in the first Fermat point X. Furthermore , the lines AE_(BC ) , BE_(AC ) , and CE_(AB ) connecting the vertices of ΔABC with the opposite vectors of the erected triangles also concur at X.",0
"Clean tile is a game investigated by Buffon in which players bet on the number of different tiles a thrown coin will partially cover on a floor that is regularly tiled .",1
"The kth power of a graph G is a graph with the same set of vertices as G and an edge between two vertices iff there is a path of length at most k between them .",1
"Furthermore , the circle with IJ_1 as the diameter has P as its center , where P is the intersection of A_1 J_1 with the circumcircle of ΔA_1 A_2 A_3 , and passes through A_2 and A_3 .",0
"Positive integers other than 1 which are not prime are called composite numbers .",1
"Unlike the Alexander polynomial , the more powerful Jones polynomial does , in most cases , distinguish handedness .",1
"Such an array is often called a grid or mesh , and is a special case of a point lattice .",1
"The geometry resulting from the application of the inversion operation .",0
"Then ( a - b ) ϕ = bϑ , so ϑ = ( a - b)/b ϕ.",0
"For example , since x^2 - 1 = ( x + 1)(x - 1 ) , both x - 1 and x + 1 are factors of x^2 - 1 .",0
"The divergence , however , is very slow .",0
"The Perkel graph is a weakly regular graph on 57 vertices and 171 edges , shown above in several embeddings .",1
"The Goldbach conjecture is then equivalent to the statement that r(n)>0 or , equivalently , that R(n)>0 , for every even integer n>1 .",0
"An integer is k - smooth if it has no prime factors > k.",1
"Excising an edge of the Petersen graph gives the 4-M?bius ladder Y_3 .",0
"Its sometimes also called the rhomboidal dodecahedron .",0
"A superellipse may be described parametrically by x | = | acos^(2 / r ) t y | = | bsin^(2 / r ) t.",0
"The first - order curve is then denoted 1 .",0
"The randomness may be present as either noise in measurements or Monte Carlo randomness in the search procedure , or both .",0
"Let G be a group and S be a topological G - set .",0
"A parabola ( plural  parabolas  ; Gray 1997 , p. 45 ) is the set of all points in the plane equidistant from a given line L ( the conic section directrix ) and a given point F not on the line ( the focus ) .",1
"A connected cubic graph contains a bridge iff it contains an articulation vertex , i.e. , if it is not a biconnected graph .",0
"In other words , every Goodstein sequence converges to 0 .",0
"A square number , also called a perfect square , is a figurate number of the form S_n = n^2 , where n is an integer .",1
"These three triples of points make nine in all , giving the circle its name .",0
"The inner Soddy circle is the circle tangent to each of the three mutually tangent circles centered at the vertices of a reference triangle .",1
"Then define θ_n iteratively by θ_(n + 1 ) = ( θ_n + 2πs ) ( mod 2π ) , with θ_0 = 0 .",0
"The Season 2 episode  Bettor or Worse  of the television crime drama NUMB3RS mentions one - dimensional cellular automata .",0
"A point p on a regular surface M element R^3 is said to be parabolic if the Gaussian curvature K(p ) = 0 but S(p)!=0 ( where S is the shape operator ) , or equivalently , exactly one of the principal curvatures ?_1 , ?_2 equals 0 .",1
"Let two disks of radius r intersect one another perpendicularly and have a diameter in common .",0
"The special orthogonal group SO_n(q ) is the subgroup of the elements of general orthogonal group GO_n(q ) with determinant 1 .",1
"A P?lya plot is a plot of the vector field of ( ?[f(z ) ] , - ?[f(z ) ] ) of a complex function f(z ) .",1
"Let r and s be positive integers which are relatively prime and let a and b be any two integers .",0
"The cross - cap can also be described as a circular hole which , when entered , exits from its opposite point ( from a topological viewpoint , both singular points on the cross - cap are equivalent ) .",1
"The incenter I is the center of the incircle for a polygon or insphere for a polyhedron ( when they exist ) .",1
"The degree is subdivided into 60 arc minutes per degree , and 60 arc seconds per arc minute .",0
"The uniform polyhedra include the Platonic solids and Kepler - Poinsot solids .",0
"A nonnegative function g(x , y ) describing the  distance  between neighboring points for a given set .",0
"For example , the only divisors of 13 are 1 and 13 , making 13 a prime number , while the number 24 has divisors 1 , 2 , 3 , 4 , 6 , 8 , 12 , and 24 ( corresponding to the factorization 24 = 2 ^ 3·3 ) , making 24 not a prime number .",0
"Decimal is the base-10 notational system for representing real numbers .",1
"The generating function for the hexagonal numbers is given by ( x(3x + 1))/(1 - x)^3 = x + 6x^2 + 15x^3 + 28x^4 + ....",1
"The equivalence classes form the Teichmüller space T_p of compact Riemann surfaces of genus p.",0
"If the radius of these circles ρ is the radius of the equal circles centered on the vertices A_1 , A_2 , and A_3 , and R_H is the radius of the circle about H , then R_ρ^2 = 4R^2 + ρ^2 - 1/2(a_1 ^ 2 + a_2 ^ 2 + a_3 ^ 2 ) , where R is the circumradius of the reference triangle .",0
"In one dimension , the Gaussian function is the probability density function of the normal distribution , f(x ) = 1/(ֿƒsqrt(2ֿ€ ) ) e^(-(x - ־¼)^2/(2ֿƒ^2 ) ) , sometimes also called the frequency curve .",1
"This function is denoted q(n , k ) or q_k(n ) .",0
"This produces a so - called  natural  cubic spline and leads to a simple tridiagonal system which can be solved easily to give the coefficients of the polynomials .",0
"A generalization of the polyominoes using a collection of equal - sized equilateral triangles ( instead of squares ) arranged with coincident sides .",0
"Each Boolean function has a unique representation ( up to order ) as a union of complete products .",0
"A subgroup H of a group G that does not include the entire group G itself is known as a proper subgroup , denoted H subset G or H < G.",1
"The volume of a dipyramid whose base is a regular n - sided polygon with side a is therefore V_n = 1/6 ncot(π / n ) a^2 h.",0
"A bijective map is also called a bijection .",1
"Furthermore , let y = f(g(x ) ) and u = g(x ) , then dy/ dx = dy/ du.",0
"In this approach , a lattice is first constructed , sized to fit the numbers being multiplied .",0
"The covariance for two random variates X and Y , each with sample size N , is defined by the expectation value cov(X , Y ) | = | ג©(X - ־¼_X)(Y - ־¼_Y)ג× | = | ג©XYג× - ־¼_X ־¼_y where ־¼_x = ג©Xג× and ־¼_y = ג©Yג× are the respective means , which can be written out explicitly as cov(X , Y ) = sum_(i = 1)^N ( ( x_i - x^_)(y_i - y^_))/N.",1
"The complex plane together with the point at infinity C union { ∞ } is known as the Riemann sphere or extended complex plane and denoted C^ * or C^^.",1
"Now repeat the process until one player has all the pennies .",0
"A triangle that is not a right triangle .",0
"A hyperbolic version of the Euclidean dodecahedron .",0
"A Mersenne number is a number of the form M_n congruent 2^n - 1 , where n is an integer .",1
"The shear matrix ( e_(ij))^s is obtained from the identity matrix by inserting s at ( i , j ) , e.g. , ( e_12)^s = [ 1 | s | 0 0 | 1 | 0 0 | 0 | 1 ] .",1
"For example , 2/3 is the reduced fraction of 8/12 .",0
"Two planes that do not intersect are said to be parallel .",0
"The cross polytope ־²_n is the regular polytope in n dimensions corresponding to the convex hull of the points formed by permuting the coordinates ( ֲ± 1 , 0 , 0 , ... , 0 ) .",1
"The usual definition calls these α and β , and the other uses β ' congruent β - 1 and α ' congruent α - 1 .",0
"Examples of successive approximations to common functions using Fourier series are illustrated above .",0
"Several special types of dodecagons are illustrated above .",0
"The matrix decomposition of a square matrix A into so - called eigenvalues and eigenvectors is an extremely important one .",0
"If a < b , the curve is a single loop with an oval ( left figure above ) or dog bone ( second figure ) shape .",1
"As time passes , the decreasing distance increases the probability of hitting the target .",0
"The first few values are summarized in the following table , where e is the base of the natural logarithm ( Le Lionnais 1983 , pp .41 - 42 ; Knuth 1998 ) .",0
"One Brocard line , triangle median , and symmedian ( out of the three of each ) are concurrent , with AΩ , CK , and BG meeting at a point , where Ω is the first Brocard point and G is the triangle centroid .",0
"< = Z_n < = ... of the group terminates with Z_n = G for some n.",0
"The common incircle of the medial triangle ΔM_A M_B M_C and the congruent triangle ΔQ_A Q_B Q_C , where Q_i are the midpoints of the line segment joining the Nagel point Na with the vertices of the original triangle ΔABC .",0
"A straight line is tangent to a given curve f(x ) at a point x_0 on the curve if the line passes through the point ( x_0 , f(x_0 ) ) on the curve and has slope f'(x_0 ) , where f'(x ) is the derivative of f(x ) .",1
"Define the angles ? and ? by letting a = cos(?/2 ) and b = e^(i? ) sin(?/2 ) .",0
"The concatenation of the ternary digits of the consecutive numbers 0 , 1 , 2 , 3 , ... gives ( 0 ) , ( 1 ) , ( 2 ) , ( 1 , 0 ) , ( 1 , 1 ) , ( 1 , 2 ) , ( 2 , 0 ) , ... ( OEIS A054635 ) .",0
"However , other sources include 0 as a quadratic residue .",0
"A complete graph is a graph in which each pair of graph vertices is connected by an edge .",1
"A statistical test making use of the statistical ranks of data points .",0
"The single - holed  ring  torus is known in older literature as an  anchor ring .",1
"A hypergraph is a graph in which generalized edges ( called hyperedges ) may connect more than two nodes .",1
"If the conic is taken as a circle , then a polygon which has both an incenter and a circumcenter ( and for which the transversals would therefore close ) is called a bicentric polygon .",1
"The surface given by the parametric equations x | = | asinu y | = | asinv z | = | asin(u + v ) .",0
"The word net has several meanings in mathematics .",0
"A finite field is a field with a finite field order ( i.e. , number of elements ) , also called a Galois field .",1
"For example , nim is a Conway game , but chess is not ( due to the possibility of draws and stalemate ) .",0
"A plot of the cells on a grid satisfying bitwise XOR(a , b)<n for consecutive values of n = 1 , 2 , ....",0
"A pentagonal dipyramid appears in the lower left as one of the polyhedral  stars  in M. C. Escher 's 1948 wood engraving  Stars  ( Forty 2003 , Plate 43 ) .",0
"The unordered subsets containing k elements are known as the k - subsets of a given set .",1
"An Egyptian fraction is a sum of positive ( usually ) distinct unit fractions .",1
"s_a(a^x ) ( red ) and log_a(a^x ) ( blue ) for a = 2 , showing their coincidence at positive integers .",0
"Rule 190 is one of the elementary cellular automaton rules introduced by Stephen Wolfram in 1983 .",0
"In general , a remainder is a quantity  left over  after performing a particular algorithm .",1
"More specifically , it is the value x^~ such that an equal number of samples are less than and greater than the value ( for an odd sample size ) , or the average of the two central values ( for an even sample size ) .",0
"Rule 220 is one of the elementary cellular automaton rules introduced by Stephen Wolfram in 1983 .",0
"Given a function f(x ) , its inverse f^(-1)(x ) is defined by f(f^(-1)(x ) ) = f^(-1)(f(x ) ) congruent x.",1
"Pondering this illusion , Poggendorff noticed and described another illusion resulting from the apparent misalignment of a diagonal line ; an illusion which today bears his name ( IllusionWorks ) .",0
"Schl?fli and Cayley classified the singular cubic surfaces .",0
"An estimator ־¸^^ is an unbiased estimator of ־¸ if ג©־¸^^ ג× = ־¸ .",1
"Also known as the alternating series test .",0
"This rule is illustrated above together with the evolution of a single black cell it produces after 15 steps .",0
"For example , the point is a degenerate case of the circle as the radius approaches 0 , and the circle is a degenerate form of an ellipse as the eccentricity approaches 0 .",0
"In the United States , the algorithm of Gale and Shapley is used to match hospitals to medical interns .",0
"An angle greater than π/2 radians ( 90 ° ) and less than π radians ( 180 ° ) .",0
"The restriction to r>2 is sometimes made .",0
"The result is the desired product .",0
"If the endpoints are not included , the interval is called open and denoted ( a , b ) .",1
"Hypothesis testing is the use of statistics to determine the probability that a given hypothesis is true .",1
"A distribution which arises in the study of half - integer spin particles in physics , P(k ) = k^s/(e^(k - μ ) + 1 ) .",0
"The cross - cap can be thought of as the object produced by puncturing a surface a single time , attaching two zips around the puncture in the same direction , distorting the hole so that the zips line up , requiring that the surface intersect itself , and then zipping up .",1
"One of Cantor 's ordinal numbers ω , ω + 1 , ω + 2 , ... , ω + ω , ω + ω + 1 , ... which is  larger  than any whole number .",0
"The Errera graph is the 17-node planar graph illustrated above that tangles the Kempe chains in Kempe 's algorithm and thus provides an example of how Kempe 's supposed proof of the four - color theorem fails .",1
"Similarly , the lines connecting the vertices of a graph are most commonly known as graph edges , but may also be called  arcs  or  lines .",1
"The tesseract is composed of 8 cubes with 3 to an edge , and therefore has 16 vertices , 32 edges , 24 squares , and 8 cubes .",0
"There are a total of ten cases .",0
"One use of the word  algebra  is the abstract study of number systems and operations within them , including such advanced topics as groups , rings , invariant theory , and cohomology .",1
"At a given point on a curve , R is the radius of the osculating circle .",0
"Skewness is a measure of the degree of asymmetry of a distribution .",1
"The general problem is , in principle , solvable by straightedge and compass alone .",0
"The rectangle function ?(x ) is a function that is 0 outside the interval [ -1/2 , 1/2 ] and unity inside it .",1
"The process leading to the solution of the three - state machine is discussed by Lin and Rado and the process leading to the solution of the four - state machine is discussed by Brady and Machlin and Stout .",0
"These two statements are equivalent formulations of the definition of the limit ( lim_(x->x_0 ) f(x ) = y_0 ) .",0
"The line on which the orthocenter H , triangle centroid G , circumcenter O , de Longchamps point L , nine - point center N , and a number of other important triangle centers lie .",0
"The figure above shows a plot of the 256×256 Hilbert matrix with elements colored according to their values .",0
"The extremum test gives slightly more general conditions under which a function with f''(x_0 ) = 0 is a maximum or minimum .",0
"This is sometimes called the Dorman - Luke construction .",0
"The figures above show the same guilloche pattern plotted in polar and Cartesian coordinates generated by a series of nested additions and multiplications of sinusoids of various periods .",0
"Equivalently , it is a path that a particle which is not accelerating would follow .",1
"As can be seen , the first man is slaughtered 4th , the second man 1st , the third man 3rd , and the fourth man 2nd , so Josephus[4 , 2 ] returns { 4 , 1 , 3 , 2 } .",0
"The n - sphere is therefore defined ( again , to a geometer ; see below ) as the set of n - tuples of points ( x_1 , x_2 , ... , x_n ) such that x_1 ^ 2 + x_2^ 2 + ...+ x_n^2 = R^2 , where R is the radius of the hypersphere .",1
"In general , an affine transformation is a composition of rotations , translations , dilations , and shears .",1
"Its multiplication table is illustrated above .",0
"The Riemann series theorem states that , by a suitable rearrangement of terms , a conditionally convergent series may be made to converge to any desired value , or to diverge .",0
"More precisely , given an ordinal number ? , a function from A^? into A is an ? - ary operation on A.",0
"Given a set of linear equations { a_1 x + b_1 y + c_1 z = d_1 a_2 x + b_2 y + c_2 z = d_2 a_3 x + b_3 y + c_3 z = d_3 ,  consider the determinant D congruent left bracketing bar a_1 | b_1 | c_1 a_2 | b_2 | c_2 a_3 | b_3 | c_3 right bracketing bar .",0
"nodes are 1 , 1 , 1 , 1 , 2 , 2 , 4 , 6 , 11 , 18 , 37 , 66 , 135 , 265 , 552 , ... ( OEIS A000672 ) .",0
"A similar identity holds for the hyperbolic functions , ( coshz + sinhz)^n = cosh(nz ) + sinh(nz ) .",0
"The Nyquist frequency , also called the Nyquist limit , is the highest frequency that can be coded at a given sampling rate in order to be able to fully reconstruct the signal , i.e. , f_Nyquist = 1/2 ־½ .",1
"An irregular dodecahedron which is also a trapezohedron .",1
"A tag system is set of rules that specifies a fixed number of elements ( commonly denoted ־½ or ־² ) be removed from the beginning of a sequence and a set of elements to be appended (  tagged  onto the end ) based on the elements that were removed from the beginning .",1
"A central dilation corresponds to an expansion plus a translation .",1
"Continue until you have crossed out all numbers divisible by ⌊sqrt(n)⌋.",0
"An algebraic surface of surface order 4 .",0
"Hardy and Wright use the term to mean asymptotic to .",0
"A cuboid whose edges and face diagonals are integers is called an Euler brick .",1
"The polynomials defined by B_(i , n)(t ) = ( n i ) t^i ( 1 - t)^(n - i ) , where ( n k ) is a binomial coefficient .",0
"The most common type of regression is linear regression .",0
"They are the solution to the simple linear recurrence equation a_n = a_(n - 1 ) + 1 with a_1 = 1 .",0
"An implicit method for solving an ordinary differential equation that uses f(x_n , y_n ) in y_(n + 1 ) .",0
"The orthic triangle is therefore both the pedal triangle and Cevian triangle with respect to H.",0
"The area of a surface or collection of surfaces bounding a solid is called , not surprisingly , the surface area .",1
"It has even been proved by Gacs that there exist fault - tolerant universal cellular automata , whose ability to simulate other cellular automata is not hindered by random perturbations provided that such perturbations are sufficiently sparse .",0
"The above surface is a generalized cylinder over a cardioid .",0
