Sentence,Definition?
"The trilinear coordinates of the circumcenter are cosA : cosB : cosC , and the exact trilinear coordinates are therefore RcosA : RcosB : RcosC , where R is the circumradius , or equivalently ( 1/2 acotA , 1/2 bcotB , 1/2 ccotC ) .",0
"Two numbers of which the successors are equal are themselves equal .",0
"This property , of course , extends to the two bunches of perpendicular lines forming the grid .",0
"The Paley graph of order q with q a prime power is a graph on q nodes with two nodes adjacent if their difference is a square in the finite field GF(q ) .",1
"In one dimension , the cross polytope is the line segment [ -1 , 1 ] .",1
"In two dimensions , the cross polytope { 4 } is the filled square with vertices ( -1 , 0 ) , ( 0 , -1 ) , ( 1 , 0 ) , ( 0 , 1 ) .",1
"The French term for a field is corps and the German word is Körper , both meaning  body .  A field with a finite number of members is known as a finite field or Galois field .",0
"Approximation theory also studies the size and properties of the error introduced by approximation .",0
"The unit circle plays a significant role in a number of different areas of mathematics .",0
"Given a power spectrum ( a plot of power vs. frequency ) , aliasing is a false translation of power falling in some frequency range ( -f_c , f_c ) outside the range .",1
"For a circle of radius a , x | = | acost y | = | asint the parametric equation of the involute is given by x_i | = | a(cost + tsint ) y_i | = | a(sint - tcost ) .",1
"The result is a chain of circles in which the sixth circle is tangent to the first .",0
"A given integer n may be negative ( n element Z^- ) , nonnegative ( n element Z^ * ) , zero ( n = 0 ) , or positive ( n element Z^+ = N ) .",0
"The final digits (  leaves  ) of each column are then placed in a row next to the appropriate column and sorted in numerical order .",0
"Wolfram considers machines with two registers and two operations :  increments  and  decrement - jumps .",0
"The cosecant cscz is the function defined by cscz | congruent | 1/(sinz ) | = | ( 2i)/(e^(iz ) - e^(-iz ) ) , where sinz is the sine .",1
"Similarly , starting the sequence instead with the digit d for 2<=d<=9 gives d , 1d , 111d , 311d , 13211d , 111312211d , 31131122211d , 1321132132211d , ... , as summarized in the following table .",0
"If lines L_1 and L_2 are parallel , the notation L_1 ∥L_2 is used .",0
"The triangle function is the function ־›(x ) | congruent | { 0 | left bracketing bar x right bracketing bar > = 1 1 - left bracketing bar x right bracketing bar | left bracketing bar x right bracketing bar < 1  | = | ־ (x)*־ (x )  | = | ־ (x)*H(x + 1/2 ) - ־ (x)*H(x - 1/2 ) , where ־ (x ) is the rectangle function , H(x ) is the Heaviside step function , and * denotes convolution .",1
"The zeroth through third iterations of the construction are shown above .",0
"It can be written as integral_(x_0)^(x_2)f(x ) dx≈h(f_0 + 4f_1 + f_2)/3 .",0
"A curve with curvature ־÷!=0 is planar iff ֿ„ = 0 .",1
"It can be constructed by gluing both pairs of opposite edges of a rectangle together giving one pair a half - twist , but can be physically realized only in four dimensions , since it must pass through itself without the presence of a hole .",0
"It is also uniform polyhedron U_8 and Wenninger model W_7 .",0
"The octahedron 5-compound is the dual of the cube 5-compound .",1
"This is accomplished by changing the so - called parallel postulate .",0
"For example , the fields Q(sqrt(-5 ) ) and Q(sqrt(-6 ) ) are not uniquely factorable , since 21 = 3·7 = ( 1 + 2sqrt(-5))(1 - 2sqrt(-5 ) ) 6 = - sqrt(-6)(sqrt(-6 ) ) = 2·3 , although the above factors are all primes within these fields .",0
"It was rediscovered by Étienne Pascal , father of Blaise Pascal , and named by Gilles - Personne Roberval in 1650 ( MacTutor Archive ) .",0
"A ruled surface M is a tangent developable of a curve y if M can be parameterized by x(u , v ) = y(u ) + vy'(u ) .",1
"A physical motivation for q - special functions is provided by generalizing the canonical commutation relation xp - px = 1 , where x is a generalized coordinate and p the corresponding generalized momentum , to xp - qpx = 1 .",0
"Among the simplest elementary functions are the logarithm , exponential function ( including the hyperbolic functions ) , power function , and trigonometric functions .",0
"Pratt showed that Lehmer 's primality heuristic could be made a nondeterministic procedure by applying it recursively to the factors of n - 1 .",0
"A procedure for decomposing an N×N matrix A into a product of a lower triangular matrix L and an upper triangular matrix U , LU = A.",0
"A cyclide is a pair of focal conics which are the envelopes of two one - parameter families of spheres , sometimes also called a cyclid .",1
"The second Fermat point X ' or F_2 ( also known as the second isogonic center ) can be constructed by drawing equilateral triangles on the inside of a given triangle and connecting opposite vertices .",1
"A sequence a_1 , a_2 , ... such that the metric d(a_m , a_n ) satisfies lim_(min(m , n)->∞ ) d(a_m , a_n ) = 0 .",0
"The circumcircle through A , Q_(AB ) , and Q_(AC ) is then known as the Lucas A - circles , and repeating the process for other sides gives the corresponding B- and C - circles .",1
"The mirror image , complement , and mirror complement are rules 246 , 130 , and 144 , respectively .",0
"A box - and - whisker plot ( sometimes called simply a box plot ) is a histogram - like method of displaying data , invented by J. Tukey .",1
"A function ֿ„(n ) related to the divisor function ֿƒ_k(n ) , also sometimes called Ramanujan 's tau function .",1
"There is a great deal of freedom in picking the representation of a cyclic decomposition since ( 1 ) the cycles are disjoint and can therefore be specified in any order , and ( 2 ) any rotation of a given cycle specifies the same cycle .",0
"2-Cayley trees are path graphs .",0
"It seems to have first appeared in the general media in a Nov. 8 , 1953 New York Times article covering discussions of a United Nations committee .",0
"Since the even numbers are integrally divisible by two , the congruence n congruent 0 ( mod 2 ) holds for even n.",0
"A tree in which each non - leaf graph vertex has a constant number of branches n is called an n - Cayley tree .",1
"A sculpture of the Boy surface as a special immersion of the real projective plane in Euclidean 3-space was installed in front of the library of the Mathematisches Forschungsinstitut Oberwolfach library building on January 28 , 1991 ( Mathematisches Forschungsinstitut Oberwolfach ) .",0
"Then a variety of different transformation formulas are possible depending on the relative positions of the projection plane and z - axis .",0
"There are exactly five such solids : the cube , dodecahedron , icosahedron , octahedron , and tetrahedron , as was proved by Euclid in the last proposition of the Elements .",0
"Consider a unit circle and a radiant point located at ( ? , 0 ) .",0
"If two numbers b and c have the property that their difference b - c is integrally divisible by a number m ( i.e. , ( b - c)/m is an integer ) , then b and c are said to be  congruent modulo m.",1
"Special cases are given in the following table .",0
"An arc corresponding to the central angle ∠AOC is denoted arcAC .",0
"Applying the first rule yields the evolution ABA toAA , while applying the second rule yields the evolution ABA->AB->A.",0
"More generally , the latitude of a point on an ellipsoid is the angle between a line perpendicular to the surface of the ellipsoid at the given point and the plane of the equator .",1
"An accumulation point is a point which is the limit of a sequence , also called a limit point .",1
"The negabinary representation of a number n is its representation in base -2 ( i.e. , base negative 2 ) .",1
"The object need not exhibit exactly the same structure at all scales , but the same  type  of structures must appear on all scales .",0
"Alternatively , some authors define a busy beaver as a Turing machine that performs a maximum number S(n ) of steps when started on an initially blank tape before halting .",1
"The dual polyhedron of the truncated octahedron is the tetrakis hexahedron .",1
"Curves with ־÷_g = 0 are called geodesics .",1
"This problem can be solved with the aid of trilinear coordinates .",0
"Topology has to do with the study of spatial objects such as curves , surfaces , the space we call our universe , the space - time of general relativity , fractals , knots , manifolds ( which are objects with some of the same basic spatial properties as our universe ) , phase spaces that are encountered in physics ( such as the space of hand - positions of a clock ) , symmetry groups like the collection of ways of rotating a top , etc .",0
"In particular , he showed that if f(r ) is a nonnegative function defined on all r element Z^+ and if there exist positive constants C and δ for which f(r)<Cr^(-δ ) sqrt(r ) , r = 1 , 2 , ... , then for almost all real numbers x element ( 0 , 1 ) with associated regular continued fraction ξ = [ 0;b_1 , b_2 , ... ] , lim_(n->∞ ) 1 / n sum_(k = 1)^n f(b_k ) = sum_(r = 1)^∞ f(r)/(ln2 ) ln(1 + 1 / r(r + 2 ) ) .",0
"The 120-cell has 600 vertices and 1200 edges .",0
"If F is the Feuerbach point a triangle ΔABC and X , Y , and Z are the midpoints of the sides BC , CA , and AB , respectively , then one of the distances left bracketing bar FX right bracketing bar , left bracketing bar FY right bracketing bar , and left bracketing bar FZ right bracketing bar is equal to the sum of the two others .",0
"A 3-cusped hypocycloid , also called a tricuspoid .",0
"An optical illusion named after British psychologist James Fraser , who first studied the illusion in 1908 .",0
"The spherical triangle is the spherical analog of the planar triangle , and is sometimes called an Euler triangle .",1
"Splines are very useful for modeling arbitrary functions , and are used extensively in computer graphics .",0
"Analysis of data ordered by the time the data were collected ( usually spaced at equal intervals ) , called a time series .",1
"Call the spheres tangent to the cone and the plane S_1 and S_2 , and the circles on which the spheres are tangent to the cone R_1 and R_2 .",0
"The simplest such  grid  is a one - dimensional line .",0
"However , the equations simplify substantially in the case x = ∞ ( i.e. , with rays perpendicular to the axis of the parabola ) , giving x | = | 3/2 t - 2t^3 y | = | 3t^2 .",0
"The point Ko of concurrence in Kosnita theorem , i.e. , the point of concurrence of the lines connecting the vertices A , B , and C of a triangle ΔABC with the circumcenters of the triangles ΔBCO , ΔCAO , and ΔABO ( where O is the circumcenter of ΔABC ) .",0
"Real numbers can be defined using either Dedekind cuts or Cauchy sequences .",0
"Let I be an interval containing the point a , let f , g , and h be functions defined on I , except possibly at a itself , suppose that for every x!=a the inequality g(x)<=f(x)<=h(x ) holds , and suppose lim_(x->a ) g(x ) = lim_(x->a ) h(x ) = L.",0
"A random polygon is a polygon generated in some random way .",1
"A statistical distribution published by William Gosset in 1908 .",0
"The orchard - planting problem ( also known as the orchard problem or tree - planting problem ) asks that n trees be planted so that there will be r(n , k ) straight rows with k trees in each row .",1
"The 600-cell has 120 vertices and 720 edges .",0
"A point lattice is a regularly spaced array of points .",1
"The star polygon { 12/5 } .",0
"Three points x_i = ( x_i , y_i , z_i ) for i = 1 , 2 , 3 are collinear iff the ratios of distances satisfy x_2 - x_1 : y_2 - y_1 : z_2 - z_1 = x_3 - x_1 : y_3 - y_1 : z_3 - z_1 .",1
"There are 2^(2^n ) Boolean functions in a Boolean algebra of order n.",0
"Another method of enumerating permutations was given by Johnson ( 1963 ; S?roul 2000 , pp . 213 - 218 ) .",0
"The above histogram shows the number of variates in bins with class interval 1 for a sample of 100 real variates with a uniform distribution from 0 and 10 .",0
"Like knots , links can be decomposed into basic units known as prime links .",0
"For a triangle ־”ABC and three points A ' , B ' , and C ' , one on each of its sides , the three Miquel circles are the circles passing through each polygon vertex and its neighboring side points ( i.e. , AC ' B ' , BA ' C ' , and CB ' A ' ) .",1
"Moreover , N is uniquely determined modulo rs .",0
"The idea of sequences in which later terms are deduced from earlier ones , which is implicit in the principle of mathematical induction , dates to antiquity .",0
"In R^n , two vectors a and b are perpendicular if their dot product a·b = 0 .",1
"A 4-cusped hypocycloid which is sometimes also called a tetracuspid , cubocycloid , or paracycle .",0
"The term is also used to refer to a regular arrangement of spheres whose unit cell form a cube .",0
"Composition is associative , so that f � (g � h ) = ( f � g) � h .",0
"The above illustrations show ( left bracketing bar Y_l^m(θ , ϕ ) right bracketing bar ) ^2 ( top ) , ℜ[Y_l^m(θ , ϕ)]^2 ( bottom left ) , and ℑ[Y_l^m(θ , ϕ)]^2 ( bottom right ) .",0
"The results of the chaos game are shown above for several values of ( n , r ) .",0
"It is composed of 600 tetrahedra , with 5 to an edge .",0
"Two planes that are not parallel always intersect in a line .",0
"The following table shows the frequency distribution of the data set illustrated by the histogram below .",0
"Modular arithmetic is the arithmetic of congruences .",1
"A unit is an element in a ring that has a multiplicative inverse .",1
"Combining all the sheets gives the full structure of the function .",0
"The inequality is sometimes also called Lagrange 's inequality , and can be written in vector form as left double bracketing bar aֲ·b right double bracketing bar < = left double bracketing bar a right double bracketing bar left double bracketing bar b right double bracketing bar .",1
"If n>3 , there is always at least one prime p between n and 2n - 2 .",0
"In older literature , complete graphs are sometimes called universal graphs .",1
"These suitable values of x are , according to both versions of the definition , those belonging to a suitable neighborhood ( an open ball in the second one ) .",0
"The radius is equal to half the diameter .",0
"There is a 1:1 correspondence of points on the large circle with points on the small circle , so the wheel should travel the same distance regardless of whether it is rolled from left to right on the top straight line or on the bottom one .",0
"A  curve  ( i.e. , a continuous map of a one - dimensional interval ) into a two - dimensional area ( a plane - filling function ) or a three - dimensional volume .",0
"The numbers remaining are prime .",0
"A developable surface has the property that it can be made out of sheet metal , since such a surface must be obtainable by transformation from a plane ( which has Gaussian curvature 0 ) and every point on such a surface lies on at least one straight line .",0
"For this , he was honored with a stamp by the government of Sweden in 1982 ( Miller ) .",0
"In a graph G , contraction of an edge e with endpoints u , v is the replacement of u and v with a single vertex such that edges incident to the new vertex are the edges other than e that were incident with u or v.",1
"A Maurer rose is a plot of a  walk  along an n- ( or 2n- ) leafed rose in steps of a fixed number d degrees , including all cosets .",1
"How many kilometers does the fly travel before getting squashed in the collision of the two trains ?",0
"This construction was first noticed by Albrecht D?rer .",0
"In such a projection , tangencies are preserved .",0
"The hexagonal scalenohedron is another irregular dodecahedron .",1
"Its rule outcomes are encoded in the binary representation 58 = 10011110_2 .",0
"While this terminology is standard in the published literature ( Gardner 1976 , Benson and Jacoby 1981 , Gardner 1988 , Pickover 2002 ) , it has been suggested at various times that such cubes instead be termed Myers cubes , Myers diagonal cubes , or diagonal magic cube ( Heinz ) .",0
"The Cayley graph associated with ( G , S ) is then defined as the directed graph having one vertex associated with each group element and directed edges ( g , h ) whenever gh^(-1 ) element S.",1
"This result is sometimes known as the second pizza theorem .",0
"A fractal also known as the torn square fractal .",1
"The term Mandelbrot set is used to refer both to a general class of fractal sets and to a particular instance of such a set .",1
"Cryptology is the science of making and breaking secure codes .",1
"A quadratic surface intersects every plane in a ( proper or degenerate ) conic section .",0
"The first few Størmer numbers are given by Conway and Guy and Todd and are given by n = 1 , 2 , 4 , 5 , 6 , 9 , 10 , 11 , 12 , 14 , 15 , 16 , 19 , 20 , ...",0
"It can be derived from Sonine 's integral .",0
"After these values are processed , the resulting set of numeric outputs is used to construct the polynomial quotient and the polynomial remainder .",0
"Tutte showed that the chromatic polynomial of a planar triangulation of a sphere possess a root close to ?^2 = ? + 1 = 2.61803 ...( OEIS A104457 ) , where ? is the golden ratio .",0
"Several types of skewness are defined , the terminology and notation of which are unfortunately rather confusing .",0
"For example , the intersection of the two polygons shown at left is the yellow region in the figure at right .",0
"If del ֲ· F = 0 , then the field is said to be a divergenceless field .",1
"For an angle to be acute , cosC>0 .",1
"An extensive site of nearest neighbor material is maintained by Lifshits .",0
"A sequence of approximations a / b to sqrt(n ) can be derived by factoring a^2 - nb^2 = ± 1 ( where -1 is possible only if -1 is a quadratic residue of n ) .",0
"It was proposed by the lawyer J. F. Banzhaf in 1965 .",0
"In the late 1950s , Australian philosopher and computer scientist Charles L. Hamblin suggested placing the operator after the operands and hence created reverse polish notation .",1
"Then s = sqrt((R_1 - R_2)^2 + h^2 ) .",0
"The torsion of a space curve , sometimes also called the  second curvature  , is the rate of change of the curve 's osculating plane .",1
"The following table summarizes the inradii from some nonregular inscriptable polygons .",0
"At this point , the boat being pursued changes course , but not speed , and proceeds straight in a new direction which is not known to the fast boat .",0
"There is an infinite family of such shapes .",0
"Define ψ(x ) congruent { 1 | 0<=x<1/2 -1 | 1/2 < x<=1 0 | otherwise  and ψ_(jk)(x ) congruent ψ(2^j x - k ) for j a nonnegative integer and 0<=k<=2^j - 1 .",0
"The illustration above shows bifurcations ( occurring at the location of the blue lines ) of the logistic map as the parameter r is varied .",0
"The Lorenz attractor is an attractor that arises in a simplified system of equations describing the two - dimensional flow of fluid of uniform depth H , with an imposed temperature difference ־”T , under gravity g , with buoyancy ־± , thermal diffusivity ־÷ , and kinematic viscosity ־½ .",1
"The number of k - subsets on n elements is therefore given by the binomial coefficient ( n k ) .",0
"For example , for the curve y = x^3 plotted above , the point x = 0 is an inflection point .",0
"When a pencil is placed at P , the inverse is drawn at P ' ( or vice versa ) .",0
"Hence requiring that , for any ?>0 , f(x ) element B(y_0 , ? ) for suitable values of x , ensures that for suitable values of x , f(x ) element U for any neighborhood U of y_0 .",0
"In this case , P(x , y ) = ( x , 0 ) is the projection .",0
"However , when used without qualification , the term  cone  often means  right cone .",1
"However , this moniker is less than optimal , since the process being described is really the decomposition of a matrix into a product of three other matrices , only one of which is diagonal , and also because all other standard types of matrix decomposition use the term  decomposition  in their names , e.g. , Cholesky decomposition , Hessenberg decomposition , and so on .",0
"This accommodates rule systems in which there is more than one possible way to perform an update .",0
"The last equality is true because f(x ) sin(nx ) | = | [ -f(-x)][-sin(-nx ) ] | = | f(-x ) sin(-nx ) .",0
"Two planes always intersect in a line as long as they are not parallel .",0
"This function describes the shape of a hanging cable , known as the catenary .",0
"The base 16 notational system for representing real numbers .",0
"Among the n ! possible permutations of n distinct items , examine the number R(n , k ) of these permutations in which exactly k items are in their original ordered positions .",0
"In technical language , the Alexander polynomial arises from the homology of the infinitely cyclic cover of a knot complement .",1
"The set of integers forms a ring that is denoted Z.",0
"If the rows are numbered from 0 to N - 1 , the path of each falling ball is a Bernoulli trial consisting of N steps .",0
"In elementary mathematics ,  graph  refers to a function graph or  graph of a function ,  i.e. , a plot .",1
"Functions with many extrema can be very difficult to graph .",0
"A transposition is therefore a permutation of two elements .",1
"A regularly spaced array of points in a square array , i.e. , points with coordinates ( m , n , ... ) , where m , n , ... are integers .",0
"There are at least two integrals called the Poisson integral .",0
"Some constants which arise in the theory of digital tree searching are The trefoil knot 3_1 , also called the threefoil knot or overhand knot , is the unique prime knot with three crossings .",1
"For linear functions in any number of variables , a Grֳ¶bner basis is equivalent to Gaussian elimination .",1
"A power mean is a mean of the form M_p(a_1 , a_2 , ... , a_n ) congruent ( 1 / n sum_(k = 1)^n a_k^p)^(1 / p ) , where the parameter p is an affinely extended real number and all a_k > = 0 .",1
"Metamathematics is another word for proof theory .",1
"For a graph with vertex count n and c connected components , the chromatic polynomial π(x ) is related to the rank polynomial R(x , y ) and Tutte polynomial T(x , y ) by π(x ) | = | x^n R(-x^(-1 ) , -1 ) | = | ( -1)^(n - c ) x^c T(1 - x , 0 ) ( extending Biggs 1993 , p. 106 ) .",0
"An apodization function ( also called a tapering function or window function ) is a function used to smoothly bring a sampled signal down to zero at the edges of the sampled region .",1
"Besides these ( Kimberling centers X_3 , X_5 , X_13 , and X_14 , respective ) , no other notable triangle centers lie on the circle .",0
"If 2a > b > a , the limaçon is dimpled .",0
"Two figures that can be transformed into each other by an isometry are said to be congruent .",1
"Archimedes ' spiral is an Archimedean spiral with polar equation r = a־¸ .",1
"A transformation consisting of a constant offset with no rotation or distortion .",0
"Now extend lines parallel to the sides of the contact triangle from the Gergonne point .",0
"A binary operation on a nonempty set A is a map f : Aֳ—A->A such that 1.f is defined for every pair of elements in A , and 2.f uniquely associates each pair of elements in A to some element of A .",1
"It was given the name  sphericon  by Colin Roberts , who independently discovered the solid in the 1960s while attempting to carve a Möbius strip without a hole in the middle out of a block of wood .",0
"If K subset R^d is a centrosymmetric set which has a twice differentiable boundary , then there are 2d + 2 normals through the center .",0
"The general sinusoid of amplitude a , angular frequency ω ( and period 2π / ω ) , and phase c is given by f(x ) = asin(ωx + c ) .",0
"Let q_a be the estimated relative importance of a product .",0
"The true Julia set J is the boundary of the filled - in set ( the set of  exceptional points  ) .",1
"The limaֳ§on is a polar curve of the form r = b + acos־¸ also called the limaֳ§on of Pascal .",1
"Therefore , for k>1 , a_k = a_(k - 1 ) + d = a_(k - 2 ) + 2d = ... = a_1 + d(k - 1 ) .",0
"This formula is frequently and mistakenly known as Bode 's rule as a result of a typo in an early reference , but is actually due to Boole .",0
"The symmedian point K is the Steiner point of the first Brocard triangle .",0
"For clarity , such numbers are perhaps best referred to as purely imaginary numbers .",0
"A generalized cylinder is a flat surface , and is sometimes called a  cylindrical surface  or  cylinder surface  .",1
"Starting with a single black cell , successive generations n = 0 , 1 , ... are given by interpreting the numbers 1 , 7 , 29 , 115 , 477 , 1843 , 7645 , ... ( OEIS A118171 ) in binary , namely 1 , 111 , 11101 , 1110011 , 111011101 , ... ( OEIS A118172 ) .",0
"Its rule outcomes are encoded in the binary representation 150 = 10010110_2 .",0
"Then sopfr(n ) for n = 1 , 2 , ... is given by 0 , 2 , 3 , 4 , 5 , 5 , 7 , 6 , 6 , 7 , 11 , 7 , 13 , 9 , 8 , ... ( OEIS A001414 ) .",0
"A simpler counterexample to the Tutte conjecture was later given by Kozyrev and Grinberg , and smaller counterexamples include the Barnette - Bosák - Lederberg graph , Faulkner - Younger graphs , Grinberg graphs , and Grünbaum graphs .",0
"The quartile including the top statistically ranked members is called the first quartile and denoted Q_1 .",1
"Then Watt 's curve C is the locus of P.",0
"A second theorem sometimes known as van Aubel 's theorem states that if ־”A ' B ' C ' is the Cevian triangle of a point P , then ( AP)/(PA ' ) = ( AB')/(B ' C ) + ( AC')/(C ' B ) .",1
"In particular , the [ L , M ] Padֳ© approximant to f is defined to be the rational function P_L(x)/Q_M(x ) , where P_L(x ) = p_0 + p_1 x + ...",1
